{
  "$schema": "../schemas/promotion-policy.schema.json",
  "version": 4,
  "active_requires": {
    "review_state": ["approved"],
    "require_changelog": true,
    "require_smoke_test": true,
    "require_owner": true
  },
  "reviews": {
    "require_reviews_file": true,
    "reviewer_must_differ_from_owner": true,
    "block_on_rejection": true,
    "groups": {
      "maintainers": {
        "members": [
          "lvxiaoer"
        ],
        "description": "Repository maintainers who can approve routine promotions."
      },
      "security": {
        "members": [
          "lvxiaoer"
        ],
        "description": "Security-focused reviewers required for higher-risk promotions."
      }
    },
    "quorum": {
      "defaults": {
        "min_approvals": 1,
        "required_groups": []
      },
      "stage_overrides": {
        "active": {
          "min_approvals": 1,
          "required_groups": [
            "maintainers"
          ]
        }
      },
      "risk_overrides": {
        "high": {
          "min_approvals": 2,
          "required_groups": [
            "maintainers",
            "security"
          ]
        }
      }
    }
  },
  "high_risk_active_requires": {
    "min_maintainers": 1,
    "require_requires_block": true
  },
  "dependency_rules": {
    "allow_name_only_refs": true,
    "allow_version_pins": true,
    "require_resolvable_refs_for_active": true,
    "auto_install_dependencies_default": true
  }
}
